risk_id,project_id,description,impact,status
17c4cede,PRJ-022,National three stay above important new Congress.,Medium,Active
28ae7997,PRJ-005,Girl enter turn statement fire program.,Low,Active
80479f99,PRJ-049,Politics main president form.,Low,Active
733be7cb,PRJ-035,Both expect draw often total American political degree.,Medium,Active
41ae5092,PRJ-001,Western daughter window exist evening modern part.,Critical,Active
017839cd,PRJ-022,Only husband must owner reduce could.,High,Active
30cf8767,PRJ-004,Huge operation serve hope.,Medium,Active
c322f2e9,PRJ-027,Remain land able nor off.,Medium,Active
6e3e1c9e,PRJ-015,After boy heart book offer.,Critical,Active
5e9939fe,PRJ-011,Adult source for class.,Medium,Active
61ead2fa,PRJ-011,Democrat material often government group mouth.,Medium,Active
86758367,PRJ-048,Test room history response eight north.,Medium,Active
76543c26,PRJ-012,Black challenge wrong military method buy light.,Medium,Active
bdd1018b,PRJ-007,Their year relate public compare ball less.,Low,Active
05db5ac9,PRJ-042,Physical moment less interest economic responsibility force.,Low,Active
1d2d5085,PRJ-026,Positive respond perform break.,Medium,Active
6b2af3aa,PRJ-023,Third surface nation last.,Critical,Active
4fa181e9,PRJ-019,Enjoy life situation someone.,Medium,Active
deac7190,PRJ-013,Source generation kitchen in.,Low,Active
56af145a,PRJ-005,Fear glass feeling world nothing.,Low,Active
167500a2,PRJ-044,Hospital effect take past wife at stop region.,Critical,Active
9664785b,PRJ-031,Friend us feel.,Low,Active
2b82a5ab,PRJ-010,Certain body glass necessary stay lead.,Medium,Active
bd89d93a,PRJ-037,Some wish soldier pull leader.,Medium,Active
66fe4340,PRJ-036,Ground charge either father add successful billion.,High,Active
7b16c936,PRJ-012,Order across TV girl newspaper bill capital hard.,Low,Active
700aa100,PRJ-042,Doctor difference amount something instead memory themselves.,Medium,Active
2571c82f,PRJ-022,Build simply indeed deal traditional position group.,Medium,Active
15b9cf2f,PRJ-001,Young when community indicate from attack today.,High,Active
6f4228d8,PRJ-015,Couple pretty employee carry.,Medium,Active
e1d926ab,PRJ-005,Bank would wife.,High,Active
33c6e25c,PRJ-036,Poor trade appear food.,Critical,Active
0b07e0a5,PRJ-008,Stop thank human safe admit.,Critical,Active
ec916ea9,PRJ-019,Detail both back idea recent detail.,Medium,Active
f36fad9b,PRJ-002,Think fund rather since else value summer.,Low,Active
900de8f5,PRJ-002,Book change region various.,Critical,Active
f3846cb9,PRJ-018,Level as himself power decide another yes.,High,Active
c216a8b4,PRJ-029,Require message letter believe choose year story.,Critical,Active
d42968e0,PRJ-026,From enjoy speech pull today way.,Low,Active
2dab3a2d,PRJ-042,Name couple thought crime.,Medium,Active
13f4b596,PRJ-039,Offer authority top entire recently game hand.,Low,Active
bca39a60,PRJ-001,Up sense heavy gas in street.,Low,Active
bff2caec,PRJ-037,Amount figure happen will.,Low,Active
a1cebac4,PRJ-011,Future general television peace want decade.,High,Active
21664f8d,PRJ-016,Fall condition discuss where.,Critical,Active
62931fbb,PRJ-007,Direction describe room save system.,Low,Active
15a01004,PRJ-031,Performance later season truth at first when party.,Medium,Active
023b3e18,PRJ-050,Use official rise instead likely piece call plant.,Medium,Active
1dda2795,PRJ-018,Material service really your.,High,Active
0a456935,PRJ-023,Than air race energy along star control type.,Critical,Active
d3fb34ea,PRJ-028,Together movement hundred get again nature.,Medium,Active
78e0921f,PRJ-048,Career significant single discover.,Medium,Active
bce1dbc4,PRJ-046,Account future Democrat film more name up man.,Critical,Active
d12db0ac,PRJ-023,Ground list human find occur while.,Critical,Active
911b07f1,PRJ-004,Eight door authority them.,Medium,Active
af09126a,PRJ-036,Else energy reflect wife term.,Low,Active
08b8615d,PRJ-009,Enter southern name we newspaper certain degree.,Low,Active
4561da1b,PRJ-015,Sometimes everything smile property few field great.,Medium,Active
9e890233,PRJ-011,Feeling forget record computer picture.,Critical,Active
be31307b,PRJ-004,Behavior car responsibility look detail smile be doctor.,Low,Active
6739715d,PRJ-003,Production boy she deep over.,Medium,Active
bd62c916,PRJ-006,To right sing structure.,High,Active
f6be0360,PRJ-011,Station soldier kid.,High,Active
0f6e1a61,PRJ-022,While leave ago table partner degree hundred house.,Medium,Active
57fa2dd1,PRJ-007,None stage beautiful process policy.,Medium,Active
eec09c1a,PRJ-011,Military range statement member.,Medium,Active
eb0c4a01,PRJ-028,Actually door matter mother vote fund.,Low,Active
826a4457,PRJ-022,Generation range enter card.,Low,Active
65310d5b,PRJ-001,Claim light voice send unit push.,Medium,Active
4f4c8688,PRJ-013,Stand stock when figure the.,Critical,Active
fc821162,PRJ-012,Bar suffer environmental owner gas practice.,Critical,Active
628a9708,PRJ-039,Each energy food four about.,Critical,Active
23c97d73,PRJ-015,Traditional wind son positive.,Medium,Active
19a24681,PRJ-034,Bad will where then each.,Low,Active
9e1d5013,PRJ-002,Agency not charge two charge.,High,Active
f45a38b4,PRJ-034,Theory speak interview trouble option.,High,Active
ea7fe113,PRJ-049,That cut natural need her impact.,Critical,Active
ee26922e,PRJ-016,Program our write.,High,Active
53e6ec05,PRJ-020,Oil important half stop glass.,High,Active
24207636,PRJ-046,Design forward country brother.,High,Active
af400d83,PRJ-028,It election involve development article.,Medium,Active
ea6c322f,PRJ-029,Fear age picture environmental compare build.,Low,Active
e8e43278,PRJ-002,Weight senior management affect technology heart.,High,Active
19cfafdf,PRJ-010,Special view say trade sing necessary.,Low,Active
5a0f08b3,PRJ-020,A hold under expect happen good.,High,Active
ba2e3b7d,PRJ-036,Approach city world me site office.,High,Active
2658082c,PRJ-037,Plant next represent image hold official address.,Low,Active
adac15e2,PRJ-019,Wait threat rich morning expect find.,Medium,Active
2cb7f033,PRJ-016,Section interesting we test she.,Medium,Active
eecbb885,PRJ-007,Present adult point market end.,Low,Active
0b8a7cc7,PRJ-021,Apply power family skill though kind.,Critical,Active
9a235bd4,PRJ-026,List night suddenly another energy hard.,Medium,Active
c5b51c1f,PRJ-037,Agent grow enter think fast serious mission plan.,Medium,Active
4eab1e72,PRJ-012,Whose employee quite teacher traditional million maintain.,Critical,Active
d8dbb2e9,PRJ-038,Follow wait particular store.,Low,Active
ef5d15d9,PRJ-040,Lay should almost as never.,Medium,Active
4ee317b4,PRJ-016,Suggest ready discover sit reality us finally.,Medium,Active
199d7e84,PRJ-036,Bill fire yes office short.,Low,Active
237a66a8,PRJ-009,These yourself make success everything item drop.,Critical,Active
687ac02d,PRJ-018,Shake key gas information range big.,Medium,Active
116ca9b8,PRJ-006,Behind if military onto.,High,Active
2364f175,PRJ-016,Audience management involve management make.,Low,Active
a35a7f2f,PRJ-038,Evening science community because but.,Critical,Active
a8744928,PRJ-004,Model really size occur significant establish apply.,Critical,Active
0ba258f0,PRJ-036,Positive speech level record.,Low,Active
afc15f9f,PRJ-004,Notice benefit onto specific though country may.,Critical,Active
2c3d7915,PRJ-047,Focus really child task local.,Low,Active
066b5a7e,PRJ-013,Amount Congress military skill large run important.,Critical,Active
464665a3,PRJ-045,Quality quickly art common.,Critical,Active
a1192ab6,PRJ-008,Station product huge job personal two.,Critical,Active
b2f22637,PRJ-011,Occur chance situation similar.,High,Active
ee9a3c6c,PRJ-016,Possible with meeting improve realize decade wind.,Low,Active
59b42c11,PRJ-019,Old watch them another common.,Medium,Active
b02e2a8a,PRJ-022,West rest focus red organization.,Low,Active
8e9fb8b6,PRJ-035,Everything value child military information.,Low,Active
8d5bc03a,PRJ-028,Peace fast range question fall.,Low,Active
0e2397dd,PRJ-031,Expert for get time plan.,Critical,Active
a3541f4d,PRJ-031,Student issue time.,High,Active
21111d39,PRJ-037,Raise chair when administration radio.,Medium,Active
894d34c9,PRJ-032,Instead loss society.,Low,Active
6c03d7b7,PRJ-018,Place dark participant chance weight building.,Critical,Active
66129e02,PRJ-048,Again some floor movie describe wife company to.,Low,Active
24c5711b,PRJ-042,Figure catch author shoulder hot.,Low,Active
8e62db9c,PRJ-002,Various property effect myself possible even visit.,Medium,Active
2a013f60,PRJ-002,Rate course computer vote feeling.,Low,Active
652b32f0,PRJ-010,Own note ball meet.,High,Active
6667c883,PRJ-037,Chair trouble book poor land.,Low,Active
b736df97,PRJ-037,Ball employee product stay.,High,Active
27825da2,PRJ-033,Agreement anything enough middle particular race peace.,Medium,Active
c5b398d6,PRJ-050,Close compare gas raise laugh.,High,Active
40c8edb1,PRJ-035,Teacher half appear deep within style suggest.,High,Active
c0735a9f,PRJ-005,Hundred above possible.,High,Active
a3996761,PRJ-026,Maintain western section high set west green.,Low,Active
7c8cf76b,PRJ-003,Road treatment first subject.,Low,Active
feee07e6,PRJ-009,May material wife whom continue.,Critical,Active
fdf89a3d,PRJ-021,Trip fact push force order face story here.,Critical,Active
2b3473a4,PRJ-010,Voice though build sea top left place.,Low,Active
0935e614,PRJ-025,Something good civil prevent senior foreign break.,Critical,Active
e5e080ec,PRJ-049,Character bad surface really wall as land.,Low,Active
b18ba37a,PRJ-039,Lawyer their look happy amount industry.,Critical,Active
4c0e6f69,PRJ-030,Reality smile so nor amount.,Medium,Active
1fdcf0ad,PRJ-041,Major man to school middle dog.,Low,Active
494f5346,PRJ-021,Support despite put ability turn nice difference.,Low,Active
7ad539fb,PRJ-033,Single religious so adult.,High,Active
a0193b47,PRJ-011,Area style meeting task act.,Medium,Active
34af1e03,PRJ-005,Step economic save body.,Critical,Active
5e807c75,PRJ-044,Some establish tonight.,Medium,Active
e897cab8,PRJ-013,Board pattern material half summer not direction.,Critical,Active
955395ed,PRJ-023,Themselves loss although opportunity.,Critical,Active
e1ee9a3c,PRJ-046,Such how them behind although condition everybody.,High,Active
8fd1bc2a,PRJ-046,Treat traditional shoulder myself surface often.,Medium,Active
41e7528b,PRJ-039,Hotel although power recognize we seek suggest.,Medium,Active
d34b5452,PRJ-030,Only build go amount gas.,High,Active
c73827a8,PRJ-043,Follow thousand direction say.,High,Active
0be50937,PRJ-016,Management front feeling take admit claim rule.,Critical,Active
cd6d047c,PRJ-045,Machine trade head boy.,Medium,Active
2b04220c,PRJ-038,Sing role value project drop tend red.,Medium,Active
ba6dbd38,PRJ-032,Himself tell my individual keep half.,High,Active
77125b33,PRJ-020,Letter president meeting every ago country.,Medium,Active
64e1e8d5,PRJ-031,Point key to sell party society.,Low,Active
a590666d,PRJ-004,West sit other majority interview face with.,Low,Active
20363767,PRJ-023,Behavior marriage sell hope affect drop step.,Low,Active
fd4ef2e8,PRJ-049,Travel be actually allow sure likely door.,Critical,Active
d6180953,PRJ-034,Story choose impact live economic only machine.,Critical,Active
e95b98fe,PRJ-040,Control argue middle person.,Critical,Active
266c33c2,PRJ-023,Listen them possible them.,Low,Active
599a9bbb,PRJ-049,Shoulder treatment water kitchen trial.,High,Active
2cb8c184,PRJ-045,Executive just quality rather two.,Medium,Active
06131a59,PRJ-049,Understand newspaper last side second call.,Low,Active
603c50b9,PRJ-036,Despite investment wind than.,Critical,Active
15dcdd50,PRJ-034,Capital with painting today weight treatment name.,Critical,Active
7e6653b5,PRJ-023,Ahead attorney matter baby water wall together.,Critical,Active
ea190829,PRJ-002,Born its avoid common tough commercial remember.,Critical,Active
1a279621,PRJ-023,Current first candidate whose medical explain discover public.,Low,Active
e2238e52,PRJ-028,Effect rich between cold though car amount.,Critical,Active
9000d3c9,PRJ-020,Must matter power child.,High,Active
65b7f765,PRJ-009,Issue sometimes letter deal cover best.,Low,Active
4438b9ed,PRJ-009,Past democratic yeah.,High,Active
7ca2cd1f,PRJ-036,Though radio watch election both say.,Low,Active
bc7ce2f9,PRJ-031,Manager pass yourself between fact for.,Critical,Active
823d8c3a,PRJ-032,Yeah see go smile from.,Medium,Active
0a098467,PRJ-025,Very much send get southern old.,Low,Active
0df42e88,PRJ-007,Another left ten nature.,Critical,Active
9bbe3856,PRJ-025,Listen cause whole fund size probably fly can.,Low,Active
3f9d6ae6,PRJ-025,Product though continue little.,Medium,Active
4912e293,PRJ-045,Speak upon personal easy actually office national.,High,Active
6d8ddd5d,PRJ-046,Whom chance peace kid machine course action.,Medium,Active
149b1186,PRJ-010,Cut above international identify lot two.,Low,Active
940e9c4f,PRJ-020,Learn level carry.,High,Active
1c824f27,PRJ-009,Hope mouth design attention play show field.,Critical,Active
2eaba5c6,PRJ-036,Bag want gun four program foot mission night.,Low,Active
457326fd,PRJ-026,Conference camera difference foreign husband remember care.,Medium,Active
5b444ff0,PRJ-018,Bank maintain feel voice.,Medium,Active
307b738b,PRJ-024,Perform understand same glass education white.,High,Active
f215bf1e,PRJ-017,Director provide bit hear course.,Medium,Active
ede4b7f6,PRJ-028,They almost pull enjoy.,Critical,Active
a51f5f81,PRJ-046,Sense economy radio wind.,Low,Active
6bfd65a0,PRJ-048,Anyone movement participant main young measure.,Critical,Active
7905ccc5,PRJ-022,Over local much memory ball represent middle amount.,Low,Active
1ad9ee47,PRJ-045,Near seem medical knowledge popular relate create.,Critical,Active
